GEO.id,GEO.id2,GEO.display-label,HD01_VD01,HD02_VD01,HD01_VD02,HD02_VD02,HD01_VD03,HD02_VD03,HD01_VD04,HD02_VD04,HD01_VD05,HD02_VD05,HD01_VD06,HD02_VD06,HD01_VD07,HD02_VD07,HD01_VD08,HD02_VD08,HD01_VD09,HD02_VD09,HD01_VD10,HD02_VD10
0500000US37001,37001,"Alamance County, North Carolina",147072,*****,103107,765,26668,459,396,131,1756,187,173,146,11803,786,3169,615,412,218,2757,535
0500000US37003,37003,"Alexander County, North Carolina",36797,*****,32700,221,1862,190,83,55,340,93,129,168,1200,241,483,223,62,94,421,203
0500000US37005,37005,"Alleghany County, North Carolina",11084,*****,10025,291,69,93,15,68,31,42,2,11,794,670,148,223,70,112,78,331
0500000US37007,37007,"Anson County, North Carolina",26785,*****,12473,126,13248,293,186,36,276,127,0,127,263,185,339,209,8,15,331,209
0500000US37009,37009,"Ashe County, North Carolina",26787,*****,25739,177,30,45,52,40,37,36,0,127,852,169,77,55,40,42,37,35
0500000US37011,37011,"Avery County, North Carolina",17951,*****,15652,436,584,109,166,99,112,97,80,117,198,194,1159,362,37,39,1122,357
0500000US37013,37013,"Beaufort County, North Carolina",47185,*****,32075,218,12330,196,119,64,203,127,28,33,1981,275,449,210,79,101,370,174
0500000US37015,37015,"Bertie County, North Carolina",20890,*****,7496,141,12935,167,137,20,89,27,6,11,122,118,105,77,8,13,97,80
0500000US37017,37017,"Bladen County, North Carolina",34629,*****,19684,355,12034,353,773,79,11,17,0,127,1334,397,793,443,24,46,769,440
0500000US37019,37019,"Brunswick County, North Carolina",101994,*****,85645,557,11503,405,320,121,458,114,0,127,1687,490,2381,546,314,272,2067,432
0500000US37021,37021,"Buncombe County, North Carolina",233249,*****,207006,773,15332,421,890,324,2282,151,187,81,3006,611,4546,626,772,303,3774,529
0500000US37023,37023,"Burke County, North Carolina",90557,*****,77371,418,6115,179,325,81,3055,153,37,41,2245,427,1409,290,240,130,1169,233
0500000US37025,37025,"Cabarrus County, North Carolina",169990,*****,134725,883,24896,553,560,191,3132,300,134,172,3496,831,3047,539,408,190,2639,483
0500000US37027,37027,"Caldwell County, North Carolina",82162,*****,73817,354,3843,254,159,81,437,56,45,44,2757,356,1104,261,58,52,1046,264
0500000US37029,37029,"Camden County, North Carolina",9719,*****,7891,110,1485,185,0,127,128,162,0,127,51,51,164,137,0,127,164,137
0500000US37031,37031,"Carteret County, North Carolina",65068,*****,57815,334,3799,292,229,125,498,93,15,26,1284,298,1428,297,223,138,1205,272
0500000US37033,37033,"Caswell County, North Carolina",23848,*****,14984,173,8084,164,167,99,10,16,9,16,220,108,374,253,110,157,264,141
0500000US37035,37035,"Catawba County, North Carolina",153149,*****,125454,796,12697,445,550,207,4921,212,11,19,6340,792,3176,567,492,245,2684,494
0500000US37037,37037,"Chatham County, North Carolina",61426,*****,47443,706,8515,274,224,60,782,103,0,127,3577,771,885,249,188,146,697,226
0500000US37039,37039,"Cherokee County, North Carolina",27317,*****,25440,104,222,198,438,187,177,127,0,127,381,165,659,238,113,100,546,206
0500000US37041,37041,"Chowan County, North Carolina",14859,*****,9147,86,5085,143,167,132,81,75,0,127,306,150,73,68,0,127,73,68
0500000US37043,37043,"Clay County, North Carolina",10418,*****,10055,97,230,178,44,55,0,127,17,31,26,48,46,62,0,127,46,62
0500000US37045,37045,"Cleveland County, North Carolina",97786,*****,74684,309,20326,240,244,67,832,58,13,22,911,306,776,227,39,36,737,225
0500000US37047,37047,"Columbus County, North Carolina",56856,*****,35071,297,17404,95,1703,122,154,64,0,127,1949,367,575,181,0,127,575,181
0500000US37049,37049,"Craven County, North Carolina",100001,*****,69475,464,22368,451,420,85,1612,286,105,89,3230,501,2791,438,546,201,2245,431
0500000US37051,37051,"Cumberland County, North Carolina",312994,*****,162533,1083,111259,1292,3233,392,7046,384,1056,117,10913,996,16954,1583,2152,465,14802,1409
0500000US37053,37053,"Currituck County, North Carolina",23299,*****,21103,104,1459,109,20,35,129,40,0,127,101,86,487,165,80,83,407,139
0500000US37055,37055,"Dare County, North Carolina",33650,*****,31602,228,1267,219,98,94,86,90,0,127,360,237,237,178,22,36,215,172
0500000US37057,37057,"Davidson County, North Carolina",160638,*****,138221,695,14438,405,729,184,2213,175,70,88,3289,690,1678,429,386,177,1292,401
0500000US37059,37059,"Davie County, North Carolina",40581,*****,36073,474,2579,127,54,50,186,54,29,46,971,486,689,265,174,235,515,164
0500000US37061,37061,"Duplin County, North Carolina",56657,*****,32508,813,14626,192,51,67,158,37,55,79,8325,916,934,372,272,321,662,213
0500000US37063,37063,"Durham County, North Carolina",258578,*****,119759,1147,96789,788,452,171,11689,275,102,101,22815,1147,6972,778,733,251,6239,779
0500000US37065,37065,"Edgecombe County, North Carolina",56247,*****,22071,332,32240,246,118,98,78,97,0,127,1232,338,508,222,0,127,508,222
0500000US37067,37067,"Forsyth County, North Carolina",342989,*****,218048,1356,89102,692,878,248,6191,274,238,210,23435,1435,5097,690,958,292,4139,584
0500000US37069,37069,"Franklin County, North Carolina",58473,*****,38922,437,15571,289,175,91,262,69,16,21,2533,430,994,328,112,100,882,304
0500000US37071,37071,"Gaston County, North Carolina",202642,*****,159627,790,30115,474,973,201,2453,142,93,79,6646,819,2735,525,405,217,2330,466
0500000US37073,37073,"Gates County, North Carolina",12039,*****,7572,63,4135,45,55,44,28,41,0,127,138,63,111,57,0,127,111,57
0500000US37075,37075,"Graham County, North Carolina",8702,*****,7869,52,14,29,597,226,109,177,22,40,45,46,46,52,28,43,18,30
0500000US37077,37077,"Granville County, North Carolina",58071,*****,34506,380,19356,236,292,121,342,72,17,27,2849,403,709,211,144,88,565,182
0500000US37079,37079,"Greene County, North Carolina",21157,*****,11053,487,7905,213,197,153,45,44,0,127,1458,487,499,361,117,173,382,328
0500000US37081,37081,"Guilford County, North Carolina",475786,*****,279555,1317,152452,707,2476,280,18337,353,170,220,15660,1389,7136,836,739,266,6397,817
0500000US37083,37083,"Halifax County, North Carolina",55293,*****,22389,184,28331,537,1772,175,334,51,0,127,390,194,2077,567,150,86,1927,585
0500000US37085,37085,"Harnett County, North Carolina",109031,*****,74933,715,22717,466,793,157,978,118,117,78,6125,787,3368,605,421,172,2947,598
0500000US37087,37087,"Haywood County, North Carolina",58597,*****,56142,311,568,125,345,92,164,52,0,127,587,329,791,270,85,89,706,250
0500000US37089,37089,"Henderson County, North Carolina",103881,*****,91734,893,3423,218,487,158,961,87,12,18,5358,906,1906,480,982,423,924,219
0500000US37091,37091,"Hertford County, North Carolina",24384,*****,8837,128,14398,172,385,93,160,4,1,3,122,95,481,167,10,14,471,166
0500000US37093,37093,"Hoke County, North Carolina",44128,*****,20484,571,15006,471,3814,304,528,143,42,54,2096,596,2158,683,167,135,1991,638
0500000US37095,37095,"Hyde County, North Carolina",5721,*****,3280,461,2097,441,8,13,5,37,0,127,323,163,8,15,0,127,8,15
0500000US37097,37097,"Iredell County, North Carolina",154632,*****,127106,731,18485,366,419,153,2632,281,161,184,3663,678,2166,458,239,141,1927,419
0500000US37099,37099,"Jackson County, North Carolina",39144,*****,32977,275,712,129,3560,249,368,127,6,9,809,271,712,232,111,109,601,201
0500000US37101,37101,"Johnston County, North Carolina",160675,*****,125392,1318,24721,508,413,182,889,163,0,127,6557,1252,2703,587,413,226,2290,492
0500000US37103,37103,"Jones County, North Carolina",10060,*****,6263,98,3289,91,65,33,7,12,34,32,222,95,180,78,0,127,180,78
0500000US37105,37105,"Lee County, North Carolina",55576,*****,36402,704,11175,284,307,123,595,53,0,127,6230,789,867,347,179,135,688,330
0500000US37107,37107,"Lenoir County, North Carolina",59307,*****,31339,226,24007,275,194,118,245,78,0,127,2691,295,831,305,154,142,677,285
0500000US37109,37109,"Lincoln County, North Carolina",75697,*****,67927,553,4132,279,338,53,416,111,29,53,1824,489,1031,403,334,242,697,307
0500000US37111,37111,"McDowell County, North Carolina",44593,*****,41151,268,1672,151,134,64,409,127,0,127,724,266,503,171,13,22,490,169
0500000US37113,37113,"Macon County, North Carolina",33453,*****,31288,266,387,134,103,73,200,45,2,3,1206,278,267,123,54,56,213,104
0500000US37115,37115,"Madison County, North Carolina",20549,*****,19833,137,298,103,103,82,58,45,0,127,123,133,134,80,42,51,92,57
0500000US37117,37117,"Martin County, North Carolina",24471,*****,12927,244,10596,188,74,91,42,46,0,127,474,260,358,145,25,40,333,141
0500000US37119,37119,"Mecklenburg County, North Carolina",882761,*****,515081,2372,266408,1382,3305,411,39566,657,573,130,39601,2510,18227,1427,2456,621,15771,1373
0500000US37121,37121,"Mitchell County, North Carolina",15680,*****,15132,228,81,92,28,36,53,61,0,127,211,237,175,73,0,127,175,73
0500000US37123,37123,"Montgomery County, North Carolina",27611,*****,19954,474,5360,111,155,61,450,30,0,127,1546,449,146,104,28,39,118,95
0500000US37125,37125,"Moore County, North Carolina",85914,*****,69985,577,12133,219,575,147,696,98,7,11,1740,581,778,214,115,97,663,200
0500000US37127,37127,"Nash County, North Carolina",94402,*****,53610,535,34678,291,362,113,713,65,0,127,3542,559,1497,437,185,138,1312,435
0500000US37129,37129,"New Hanover County, North Carolina",197272,*****,155774,590,29802,466,823,191,2607,148,81,71,5316,656,2869,605,275,148,2594,587
0500000US37131,37131,"Northampton County, North Carolina",22161,*****,8858,52,12911,186,45,37,7,12,0,127,15,24,325,171,0,127,325,171
0500000US37133,37133,"Onslow County, North Carolina",169207,*****,123986,789,27572,512,1182,278,3271,231,395,176,7089,816,5712,731,1201,331,4511,586
0500000US37135,37135,"Orange County, North Carolina",129562,*****,98464,787,15721,339,539,137,8516,224,26,33,3819,704,2477,518,268,152,2209,495
0500000US37137,37137,"Pamlico County, North Carolina",13072,*****,10002,99,2628,108,18,35,28,36,0,127,116,100,280,112,2,5,278,112
0500000US37139,37139,"Pasquotank County, North Carolina",40167,*****,23237,294,15167,158,199,66,430,76,0,127,543,320,591,199,110,105,481,187
0500000US37141,37141,"Pender County, North Carolina",50256,*****,38401,425,9546,150,258,121,226,49,0,127,1434,425,391,189,9,14,382,188
0500000US37143,37143,"Perquimans County, North Carolina",13091,*****,9450,79,3515,6,0,127,0,127,0,127,87,73,39,46,10,16,29,44
0500000US37145,37145,"Person County, North Carolina",38942,*****,27051,267,10688,204,242,51,52,61,9,18,512,261,388,201,122,127,266,149
0500000US37147,37147,"Pitt County, North Carolina",161385,*****,96928,568,54735,452,345,145,2373,200,0,127,4030,576,2974,526,308,144,2666,479
0500000US37149,37149,"Polk County, North Carolina",20289,*****,18703,230,996,10,62,48,105,127,0,127,225,191,198,91,98,73,100,52
0500000US37151,37151,"Randolph County, North Carolina",140034,*****,120872,1034,8008,389,650,273,1370,91,8,13,7323,1075,1803,349,160,114,1643,345
0500000US37153,37153,"Richmond County, North Carolina",46477,*****,28620,335,14140,222,1099,124,265,99,0,127,1641,339,712,267,0,127,712,267
0500000US37155,37155,"Robeson County, North Carolina",131708,*****,41214,786,31865,207,49379,624,963,74,111,18,4932,851,3244,586,385,205,2859,594
0500000US37157,37157,"Rockingham County, North Carolina",93322,*****,70717,449,17845,292,202,99,369,101,27,43,2712,418,1450,306,144,102,1306,273
0500000US37159,37159,"Rowan County, North Carolina",136880,*****,105558,981,22080,515,420,154,1309,204,133,111,5525,987,1855,445,146,134,1709,406
0500000US37161,37161,"Rutherford County, North Carolina",66928,*****,57884,278,6583,379,154,89,123,63,0,127,858,455,1326,304,121,128,1205,292
0500000US37163,37163,"Sampson County, North Carolina",62832,*****,35567,395,17337,213,984,157,278,9,63,80,7114,391,1489,299,566,205,923,213
0500000US37165,37165,"Scotland County, North Carolina",36325,*****,17516,205,14157,159,3443,197,109,113,38,41,218,165,844,251,62,86,782,245
0500000US37167,37167,"Stanly County, North Carolina",60109,*****,50525,387,6835,301,75,43,1123,48,0,127,908,362,643,190,22,30,621,189
0500000US37169,37169,"Stokes County, North Carolina",47194,*****,44414,149,1993,94,144,106,173,8,0,127,160,138,310,135,22,30,288,134
0500000US37171,37171,"Surry County, North Carolina",73287,*****,67736,456,2777,318,240,81,326,57,60,87,1347,389,801,259,130,123,671,241
0500000US37173,37173,"Swain County, North Carolina",13861,*****,9415,154,125,118,3505,292,198,166,0,127,214,154,404,244,148,141,256,179
0500000US37175,37175,"Transylvania County, North Carolina",32404,*****,29833,278,1182,252,52,57,312,276,0,127,547,290,478,266,81,100,397,277
0500000US37177,37177,"Tyrrell County, North Carolina",4374,*****,2547,452,1613,324,17,20,8,15,0,127,97,105,92,177,0,127,92,177
0500000US37179,37179,"Union County, North Carolina",190346,*****,156214,1111,22355,471,791,132,2665,218,32,39,5357,1115,2932,496,645,289,2287,384
0500000US37181,37181,"Vance County, North Carolina",44975,*****,19239,147,22438,178,183,77,215,87,0,127,2535,197,365,178,23,38,342,167
0500000US37183,37183,"Wake County, North Carolina",850546,*****,577130,2439,174700,878,2671,385,43596,582,193,125,37001,2494,15255,1180,2358,650,12897,1050
0500000US37185,37185,"Warren County, North Carolina",20810,*****,8036,178,11027,178,860,153,73,103,0,127,501,180,313,184,0,127,313,184
0500000US37187,37187,"Washington County, North Carolina",13248,*****,6061,54,6935,174,76,99,28,33,0,127,68,82,80,83,0,127,80,83
0500000US37189,37189,"Watauga County, North Carolina",49705,*****,47102,240,511,130,112,53,431,86,0,127,488,275,1061,188,99,94,962,173
0500000US37191,37191,"Wayne County, North Carolina",120102,*****,70835,528,38103,351,223,96,1286,191,89,73,6845,629,2721,552,545,230,2176,450
0500000US37193,37193,"Wilkes County, North Carolina",69063,*****,62447,316,2912,142,235,46,334,41,11,18,2444,349,680,290,203,128,477,252
0500000US37195,37195,"Wilson County, North Carolina",79533,*****,41313,490,30936,228,143,72,470,190,10,16,5333,447,1328,325,269,142,1059,279
0500000US37197,37197,"Yadkin County, North Carolina",38158,*****,34491,437,1442,113,86,63,53,61,0,127,1882,431,204,72,20,32,184,65
0500000US37199,37199,"Yancey County, North Carolina",17911,*****,17425,106,117,67,65,61,66,60,41,40,60,68,137,97,0,127,137,97
